{
  "schemaVersion": 1,
  "patch": "26.20",
  "generatedAt": "2026-10-16T12:00:00Z",
  "runId": "2026-10-16T1200-a1b2c3",
  "keyId": "0123456789ABCDEF",
  "files": [
    { "path": "euw1/diamond_plus/Viego/JUNGLE.json", "sha256": "9f86d081884c7d659a2feaa0c55ad015a3bf4f1b2b0b822cd15d6c15b0f00a08", "bytes": 1834 }
  ]
}
